NO_UF,SG_UF,CO_UF,nome_municipio,id_municipio,nome_mesorregiao,id_mesorregiao,nome_escola,id_escola,dependencia,localizacao,funcionamento,sede,alocacao,ocupacao,endereco,telefone
Alagoas,AL,27,Porto Calvo,2707305,Leste Alagoano,3,ESCOLA MUNICIPAL DE ENSINO FUNDAMENTAL DOM ADELMO MACHADO,27031454,3,2,2,,,,"FAZENDA CRASTO, , , , 57900000",32921309
Alagoas,AL,27,Porto Calvo,2707305,Leste Alagoano,3,EMEF JOSE PIMENTEL PRADO,27031462,3,1,1,,1,1,"RUA CORONEL CLODOALDO DA FONSECA, S/N, , CENTRO, 57900000",32921786
Alagoas,AL,27,Porto Calvo,2707305,Leste Alagoano,3,EMEF MANOEL FERREIRA DE BARROS,27031470,3,1,1,,1,1,"RUA DA ALEGRIA, SN, , CENTRO, 57900000",32921803
Alagoas,AL,27,Porto Calvo,2707305,Leste Alagoano,3,ESCOLA MUNICIPAL DE ENSINO FUNDAMENTAL PEDRO VALERIANO,27031489,3,2,2,,,,"FAZENDA QUITANDA, , , , 57900000",32921309
Alagoas,AL,27,Porto Calvo,2707305,Leste Alagoano,3,ESCOLA MUNICIPAL DE ENSINO FUNDAMENTAL SECUNDINA ALVES PRADO,27031500,3,2,2,,,,"FAZENDA BELA VISTA, , , , 57900000",32921309
Alagoas,AL,27,Porto Calvo,2707305,Leste Alagoano,3,EMEF BERNARDO SOBRINHO E ANEXOS,27031543,3,2,1,,1,1,"POVOADO CAXANGA, S/N, , ZONA RURAL, 57900000",
Alagoas,AL,27,Porto Calvo,2707305,Leste Alagoano,3,ESCOLA MUNICIPAL DE ENSINO FUNDAMENTAL MARCOS II,27031578,3,2,2,,,,"FAZENDA MARCOS II, , , , 57900000",32921309
Alagoas,AL,27,Porto Calvo,2707305,Leste Alagoano,3,ESCOLA MUINICIPAL DE ENSINO FUNDAMENTAL JOAO MORAES,27031616,3,2,2,,,,"FAZENDA PRAZERES, , , , 57900000",32921309
Alagoas,AL,27,Porto Calvo,2707305,Leste Alagoano,3,EMEF LAMENHA FILHO,27031624,3,1,1,,1,1,"RUA DR MIGUEL OMENA, , , CENTRO, 57900000",
Alagoas,AL,27,Porto Calvo,2707305,Leste Alagoano,3,EMEF NOSSA SENHORA DA CONCEICAO E ANEXOS,27031640,3,2,1,,1,1,"ASSENTAMENTO MACIAPE, SN, , ZONA RURAL, 57900000",
Alagoas,AL,27,Porto Calvo,2707305,Leste Alagoano,3,ESCOLA MUNICIPAL DE EDUCACAO INFANTIL CANTINHO FELIZ,27031683,3,1,1,,1,2,"RUA PROFESSOR GUEDES DE MIRANDA, 8, , CENTRO, 57900000",32921309
Alagoas,AL,27,Porto Calvo,2707305,Leste Alagoano,3,CEI SOLAR DA CRIANCA,27049590,3,1,1,,1,1,"POVOADO MANGAZALA, , , , 57900000",
Alagoas,AL,27,Porto Calvo,2707305,Leste Alagoano,3,CENTRO DE ATENDIMENTO EDUCACIONAL ESPECIALIZADO ANA SALDANHA LINS LEAO,27054020,3,1,1,,1,1,"RUA DO POSTO, S/N, LOTEAMENTO JORGE ALV, MANGAZALA, 57900000",994043723
Alagoas,AL,27,Porto Calvo,2707305,Leste Alagoano,3,EMEF DOMINGOS FERNANDES CALABAR,27216144,3,1,1,,1,1,"POVOADO MANGAZALA, , , CENTRO, 57900000",32921309
Alagoas,AL,27,Porto Calvo,2707305,Leste Alagoano,3,ESCOLA MUNICIPAL DE ENSINO FUNDAMENTAL LOMBA,27219593,3,2,2,,,,"FAZENDA LOMBA, , , , 57900000",32921309
Alagoas,AL,27,Porto Calvo,2707305,Leste Alagoano,3,EMEF NIVALDO NUNES DE MOURA E ANEXOS,27221725,3,2,1,,1,1,"USINA SANTA MARIA, , , ZONA RURAL, 57900000",32926583
Alagoas,AL,27,Porto Calvo,2707305,Leste Alagoano,3,ESCOLA MUNICIPAL DE ENSINO FUNDAMENTAL DE ORIENTE,27221741,3,2,2,,,,"FAZENDA ORIENTE, , , , 57900000",32921309
Alagoas,AL,27,Porto Calvo,2707305,Leste Alagoano,3,EMEF DE CANAAN,27221750,3,2,1,,1,1,"LOTEAMENTO OSCAR CUNHA, , , , 57900000",32921309
Alagoas,AL,27,Porto Calvo,2707305,Leste Alagoano,3,EMEF DEPUTADA CECI CUNHA,27221776,3,1,1,,1,1,"RUA DEPUTADO JOAO BATISTA DE MORAES, S/N, , CENTRO, 57900000",
Alagoas,AL,27,Porto Calvo,2707305,Leste Alagoano,3,CRECHE ESCOLA VOVO DO CARMO,27227030,3,1,1,,1,2,"RUA DO RAFAEL, S/N, PRXIMO AO FORUM, CENTRO, 57900000",32921309
Alagoas,AL,27,Porto Calvo,2707305,Leste Alagoano,3,ESCOLA MUNICIPAL DE ATIVIDADE COMPLEMENTAR DO PETI PORTO CALVO,27343014,3,1,1,,1,1,"TRAVESSA DA CONCEICAO, S/N, , CENTRO, 57900000",32921309
Alagoas,AL,27,Porto Calvo,2707305,Leste Alagoano,3,ESCOLA MUNICIPAL DE ATIVIDADE COMPLEMENTAR DO PETI DA USINA SANTA MARIA,27345017,3,2,2,,,,"USINA SANTA MARIA, ZONA RURAL, S/N, , ZONA RURAL, 57900000",32921309
Alagoas,AL,27,Porto de Pedras,2707404,Leste Alagoano,3,EE CIRIDIAO DURVAL,27033384,2,1,1,,1,1,"RUA JOAO PESSOA, 207, , CENTRO, 57945000",
Alagoas,AL,27,Porto de Pedras,2707404,Leste Alagoano,3,GRUPO ESCOLAR JOSE BONIFACIO DE ANDRADE E SILVA,27033392,3,2,2,,,,"FAZENDA DESTERRO, SN, , ZONA RURAL, 57945000",
Alagoas,AL,27,Porto de Pedras,2707404,Leste Alagoano,3,GRUPO ESCOLAR LEONILA DA GLORIA PINTO CUNHA,27033406,3,1,1,,1,1,"RUA FERNANDES LIMA, 11, , CENTRO, 57945000",993675746
Alagoas,AL,27,Porto de Pedras,2707404,Leste Alagoano,3,GRUPO ESCOLAR LUIZ CUNHA,27033414,3,2,1,,1,1,"FAZENDA CANAVIEIRA DE BAIXO, SN, , ZONA RURAL, 57945000",32981492
Alagoas,AL,27,Porto de Pedras,2707404,Leste Alagoano,3,GRUPO ESCOLAR LUIZ MARQUES,27033422,3,2,2,,,,"FAZENDA PORTO DE OSTRA, SN, , ZONA RURAL, 57945000",32981492
Alagoas,AL,27,Porto de Pedras,2707404,Leste Alagoano,3,GRUPO ESCOLAR ADERBAL DA COSTA RAPOSO,27033430,3,2,2,,,,"FAZENDA BARBACO, , , , 57945000",
Alagoas,AL,27,Porto de Pedras,2707404,Leste Alagoano,3,GRUPO ESC COLIMERIA A LINS FREITAS,27033457,3,2,2,,,,"FAZENDA MUICAITA, , , , 57945000",
Alagoas,AL,27,Porto de Pedras,2707404,Leste Alagoano,3,GRUPO ESCOLAR JOSE DA HORA,27033465,3,2,2,,,,"FAZENDA SAO JOAO, , , , 57945000",
Alagoas,AL,27,Porto de Pedras,2707404,Leste Alagoano,3,GRUPO ESCOLAR ASSIS LIMA,27033481,3,1,1,,1,1,"RUA FERNANDES LIMA, 11, , CENTRO, 57945000",32981492
Alagoas,AL,27,Porto de Pedras,2707404,Leste Alagoano,3,GRUPO ESCOLAR DOMINGOS TOMAZ DA SILVA,27033511,3,2,1,,1,1,"FAZENDA BOA VISTA, SN, , ZONA RURAL, 57945000",32981492
Alagoas,AL,27,Porto de Pedras,2707404,Leste Alagoano,3,GRUPO ESCOLAR HELIO CUNHA,27033520,3,2,2,,,,"FAZENDA CANAVIEIRA DE CIMA, SN, , ZONA RURAL, 57945000",23981492
Alagoas,AL,27,Porto de Pedras,2707404,Leste Alagoano,3,GRUPO ESCOLAR JOAO ANTONIO DA COSTA,27033538,3,2,1,,1,1,"RUA 09 DE JUNHO, SN, , POVOADO LAGES, 57945000",
Alagoas,AL,27,Porto de Pedras,2707404,Leste Alagoano,3,GRUPO ESCOLAR JOAO DO REGO MELO,27033546,3,2,1,,1,1,"FAZENDA VITORIA, SN, , ZONA RURAL, 57945000",32981492
Alagoas,AL,27,Porto de Pedras,2707404,Leste Alagoano,3,GRUPO ESCOLAR JULIO DORTA,27033554,3,2,2,,,,"FAZENDA BOA ESPERANCA, SN, , ZONA RURAL, 57945000",32981492
Alagoas,AL,27,Porto de Pedras,2707404,Leste Alagoano,3,GRUPO ESCOLAR LOURENCO CANAVARRO,27033562,3,2,2,,,,"FAZENDA ANTONIO DIAS, , , , 57945000",
Alagoas,AL,27,Porto de Pedras,2707404,Leste Alagoano,3,GRUPO ESCOLAR MANOEL SALDANHA LEAO,27033570,3,2,2,,,,"FAZENDA SAO GERALDO, SN, , ZONA RURAL, 57945000",32981492
Alagoas,AL,27,Porto de Pedras,2707404,Leste Alagoano,3,GRUPO ESCOLAR MOREIRA E SILVA,27033589,3,2,2,,,,"FAZENDA ASTRO, SN, , ZONA RURAL, 57945000",32981492
Alagoas,AL,27,Porto de Pedras,2707404,Leste Alagoano,3,GRUPO ESCOLAR NOSSA SRA APARECIDA,27033597,3,2,2,,,,"FAZENDA GUANABARA, , , , 57945000",
Alagoas,AL,27,Porto de Pedras,2707404,Leste Alagoano,3,GRUPO ESCOLAR ORLANDO DORTA,27033600,3,2,1,,1,1,"RUA LUIZ FERREIRA DORTA, SN, , POVOADO PALMEIRA, 57945000",32981492
Alagoas,AL,27,Porto de Pedras,2707404,Leste Alagoano,3,GRUPO ESCOLAR PE ALIPIO,27033627,3,1,1,,1,1,"RUA FERNANDES LIMA, 11, , CENTRO, 57945000",32981528
Alagoas,AL,27,Porto de Pedras,2707404,Leste Alagoano,3,GRUPO ESCOLAR STA EFIGENIA,27033643,3,2,2,,,,"FAZENDA OURIVES, SN, , ZONA RURAL, 57945000",32981492
Alagoas,AL,27,Porto de Pedras,2707404,Leste Alagoano,3,GRUPO ESCOLAR TRAJANO PINTO,27033651,3,2,2,,,,"FAZENDA SAAO PAULO, , , , 57945000",
Alagoas,AL,27,Porto de Pedras,2707404,Leste Alagoano,3,CRECHE MUNICIPAL EULALIA MOREIRA MENDONCA,27033678,3,2,1,,1,3,"RUA EMILIO JOSE GONCALVES, SN, POVOADO TATUAMUNHA, , 57945000",32981492
Alagoas,AL,27,Porto de Pedras,2707404,Leste Alagoano,3,CRECHE MUNICIPAL ZULMIRA MARIA DOS SANTOS,27048292,3,1,1,,1,1,"RUA DA PIEDADE, SN, , SALINAS, 57945000",32981492
Alagoas,AL,27,Porto de Pedras,2707404,Leste Alagoano,3,ESCOLA MUNICIPAL JOSE ALOISIO DA CUNHA,27216594,3,2,1,,1,1,"FAZENDA LUCENA, SN, ASSENTAMENTO, ZONA RURAL, 57945000",32981492
Alagoas,AL,27,Porto de Pedras,2707404,Leste Alagoano,3,CENTRO MUNICIPAL DE EDUCACAO INFANTIL SEBASTIAO FALCAO DE LIMA,27217248,3,2,1,,1,1,"RUA JOAO DO REGO MELO, SN, POVOADO CURTUME, CURTUME, 57945000",32981492
Alagoas,AL,27,Porto de Pedras,2707404,Leste Alagoano,3,ESCOLA MUNICIPAL ALZIRA MOREIRA DA SILVA,27221717,3,2,2,,,,"FAZENDA ASTRO, , , ZONA RURAL, 57945000",32981492
Alagoas,AL,27,Porto de Pedras,2707404,Leste Alagoano,3,CRECHE MUL JULITA BATISTA CAVALCANTE,27340023,3,2,1,,1,2,"RUA JOAO DO REGO MELO, SN, POVOADO CURTUME, , 57945000",32981492
Alagoas,AL,27,Porto de Pedras,2707404,Leste Alagoano,3,GRUPO ESCOLAR CARLOS PROCOPIO,27033503,3,2,1,,1,3,"RUA EMILIO JOSE GONCALVES, SN, , POV. TATUAMUNHA, 57945000",32986295
Alagoas,AL,27,Porto Real do Colégio,2707503,Leste Alagoano,3,ESCOLA MUNICIPAL DE ENSINO FUNDAMENTAL PROFº ERNANI DE FIGUEIREDO MAGALHAES,27045986,3,1,1,,1,1,"RUA DA INDEPENDENCIA, S/N, , CENTRO, 57290000",35531430
Alagoas,AL,27,Porto Real do Colégio,2707503,Leste Alagoano,3,ESCOLA MUNICIPAL DE EDUCACAO BASICA PROFESSORA ANTONIA ROSA,27045994,3,2,1,,1,1,"POVOADO CANOA DE CIMA, S/N, , , 57290000",996326087
Alagoas,AL,27,Porto Real do Colégio,2707503,Leste Alagoano,3,ESCOLA MUNICIPALDE EDUCACAO BASICA JOSE IZIDORIO DA SILVA,27046001,3,2,1,,1,1,"POVOADO MARABA, S/N, , , 57290000",35531192
Alagoas,AL,27,Porto Real do Colégio,2707503,Leste Alagoano,3,ESCOLA MUNICIPAL DE EDUCACAO BASICA MANOEL ALEXANDRE COSTA,27046010,3,2,1,,1,1,"POVOADO ENTRADA, S/N, , , 57290000",996326087
Alagoas,AL,27,Porto Real do Colégio,2707503,Leste Alagoano,3,ESCOLA MUNICIPAL DE EDUCACAO BASICA ADEMARIO VIEIRA DANTAS,27046028,3,2,1,,1,1,"POVOADO PAU DA FACEIRA, S/N, , , 57290000",35531192
Alagoas,AL,27,Porto Real do Colégio,2707503,Leste Alagoano,3,ESCOLA MUNICIPAL DE EDUCACAO BASICA ANANIAS DE ASSUNCAO NERI,27046036,3,2,1,,1,1,"POVOADO GILA DE BAIXO, S/N, ZONA RURAL, , 57290000",35531192
Alagoas,AL,27,Porto Real do Colégio,2707503,Leste Alagoano,3,ESCOLA MUNICIPAL DE EDUCACAO BASICA ANTONIO JOSE DA SILVA,27046044,3,2,2,,,,"POVOADO SOBRADO, S/N, , , 57290000",35531603
Alagoas,AL,27,Porto Real do Colégio,2707503,Leste Alagoano,3,ESCOLA MUNICIPAL DE EDUCACAO BASICA ARISTIDES FARIAS DOS SANTOS,27046052,3,2,1,,1,1,"POVOADO LAGOA FUNDA, S/N, , , 57290000",35531603
Alagoas,AL,27,Porto Real do Colégio,2707503,Leste Alagoano,3,ESCOLA MUNICIPAL DE EDUCACAO BASICA DEP JOSE DE OLIVEIRA COSTA,27046079,3,2,1,,1,1,"POVOADO SALOMEZINHO, S/N, ZONA RURAL, , 57290000",996606139
Alagoas,AL,27,Porto Real do Colégio,2707503,Leste Alagoano,3,ESCOLA MUNICIPAL DE EDUCACAO BASICA DR JAIME LUSTOSA DE ALTAVILA,27046087,3,2,1,,1,1,"POVOADO TAPERA DO ITIUBA, S/N, ZONA RURAL, , 57290000",35531603
Alagoas,AL,27,Porto Real do Colégio,2707503,Leste Alagoano,3,ESCOLA MUNICIPAL DE EDUCACAO BASICA EDUARDO MAGALHAES,27046095,3,2,2,,,,"POVOADO TAPERA DO JIRAU, S/N, ZONA RURAL, , 57290000",35531392
Alagoas,AL,27,Porto Real do Colégio,2707503,Leste Alagoano,3,ESCOLA MUNICIPAL DE EDUCACAO BASICA FRANCISCO HIGINO,27046109,3,2,2,,,,"POVOADO BURGO, , , , 57290000",35531603
Alagoas,AL,27,Porto Real do Colégio,2707503,Leste Alagoano,3,ESCOLA MUNICIPAL DE EDUCACAO BASICA VEREADOR JOSE DA SILVA NERI,27046117,3,2,1,,1,1,"POVOADO GILA DE CIMA, , ZONA RURAL, , 57290000",35531192
Alagoas,AL,27,Porto Real do Colégio,2707503,Leste Alagoano,3,ESCOLA MUNICIPAL DE EDUCACAO BASICA MANOEL ACELINO,27046125,3,2,2,,,,"POVOADO CARIRI, S/N, ZONA RURAL, , 57290000",35531192
Alagoas,AL,27,Porto Real do Colégio,2707503,Leste Alagoano,3,ESCOLA MUNICIPAL DE EDUCACAO BASICA MANOEL ANTONIO DE OLIVEIRA,27046133,3,2,2,,,,"POVOADO GIRAU DO ITIUBA, S/N, , , 57290000",35531603
Alagoas,AL,27,Porto Real do Colégio,2707503,Leste Alagoano,3,ESCOLA MUNICIPAL DE EDUCACAO BASICA MANOEL FERREIRA,27046141,3,2,2,,,,"POVOADO CANOA DE BAIXO, , ZONA RURAL, , 57290000",981446312
Alagoas,AL,27,Porto Real do Colégio,2707503,Leste Alagoano,3,ESCOLA MUNICIPAL DE EDUCACAO BASICA MANOEL LUIZ DE FRANCA,27046150,3,2,2,,,,"POVOADO TUCUNS, S/N, ZONA RURAL, , 57290000",996606139
Alagoas,AL,27,Porto Real do Colégio,2707503,Leste Alagoano,3,ESCOLA MUNICIPAL DE EDUCACAO BASICA MANOEL RUFINO DOS SANTOS,27046168,3,2,2,,,,"POVOADO ANGICO, S/N, , , 57290000",35531603
Alagoas,AL,27,Porto Real do Colégio,2707503,Leste Alagoano,3,ESCOLA MUNICIPAL DE EDUCACAO BASICA NOSSA SENHORA APARECIDA,27046176,3,2,2,,,,"POVOADO RIBEIRINHA, , , , 57290000",35531603
Alagoas,AL,27,Porto Real do Colégio,2707503,Leste Alagoano,3,ESCOLA MUNICIPAL DE EDUCACAO BASICA PEDRO CICERO DA COSTA,27046184,3,2,2,,,,"POVOADO CASTRO, S/N, , , 57290000",35531603
Alagoas,AL,27,Porto Real do Colégio,2707503,Leste Alagoano,3,ESCOLA MUNICIPAL DE EDUCACAO BASICA PRESIDENTE DUTRA,27046206,3,2,1,,1,1,"POVOADO CARNAIBAS DE CIMA, S/N, ESCOLA, ZONA RURAL, 57290000",35538117
Alagoas,AL,27,Porto Real do Colégio,2707503,Leste Alagoano,3,ESCOLA MUNICIPAL DE EDUCACAO BASICA PRESIDENTE TANCREDO DE ALMEIDA NEVES,27046214,3,2,1,,1,1,"POVOADO MARABINHA, S/N, ZONA RURAL, , 57290000",981446312
Alagoas,AL,27,Porto Real do Colégio,2707503,Leste Alagoano,3,ESCOLA MUNICIPAL DE EDUCACAO BASICA MANOEL LUIZ DE SANTANA GATO,27046222,3,2,1,,1,1,"POVOADO BORGES, , , , 57290000",35531603
Alagoas,AL,27,Porto Real do Colégio,2707503,Leste Alagoano,3,ESCOLA MUNICIPAL DE EDUCACAO BASICA PROFESSORA ANGELITA DE OLIVEIRA SILVA,27046230,3,2,2,,,,"POVOADO COQUEIRO DA MARABA, S/N, , , 57290000",35531603
Alagoas,AL,27,Porto Real do Colégio,2707503,Leste Alagoano,3,ESCOLA MUNICIPAL DE EDUCACAO BASICA SAO SEBASTIAO,27046249,3,2,1,,1,1,"POVOADO FLEXEIRAS, S/N, , ZONA RURAL, 57290000",35538117
Alagoas,AL,27,Porto Real do Colégio,2707503,Leste Alagoano,3,ESCOLA MUNICIPAL DE EDUCACAO BASICA MANOEL DOS SANTOS ROCHA,27046257,3,2,1,,1,1,"POVOADO RETIRO II, S/N, ZONA RURAL, , 57290000",35531192
Alagoas,AL,27,Porto Real do Colégio,2707503,Leste Alagoano,3,ESCOLA ESTADUAL INDIGENA PAJE FRANCISCO QUEIROZ SUIRA,27046265,2,2,1,,1,1,"ALDEIA INDIGENA KARIRI XOCO, SN, COMUNIDADE, ZONA RURAL, 57290000",35531687
Alagoas,AL,27,Porto Real do Colégio,2707503,Leste Alagoano,3,ESCOLA MUNICIPAL DE EDUCACAO BASICA DR JULIO FLORENCIO FILHO,27046273,3,2,1,,1,1,"POVOADO CARNAIBA DE BAIXO, S/N, ESCOLA, ZONA RURAL, 57290000",35538117
Alagoas,AL,27,Porto Real do Colégio,2707503,Leste Alagoano,3,ESCOLA MUNICIPAL DE EDUCACAO BASICA PROFESSOR JOAO VIEIRA,27046281,3,2,2,,,,"POVOADO CAPIM GROSSO, , , , 57290000",35531603
Alagoas,AL,27,Porto Real do Colégio,2707503,Leste Alagoano,3,ESCOLA MUNICIPAL DE EDUCACAO BASICA PE HILDEBRANDO MENDES COSTA,27046290,3,2,1,,1,1,"POVOADO BARRA DO ITIUBA, S/N, ZONA RURAL, , 57290000",
Alagoas,AL,27,Porto Real do Colégio,2707503,Leste Alagoano,3,ESCOLA ESTADUAL D SANTA BULHOES,27046303,2,1,1,,1,1,"PRACA ROSITA DE GOES MONTEIRO, 866, PRACA, CENTRO, 57290000",35531740
Alagoas,AL,27,Porto Real do Colégio,2707503,Leste Alagoano,3,ESCOLA ESTADUAL FIRMO DE CASTRO,27046311,2,1,1,,1,1,"AV ADEMARIO VIEIRA DANTAS, 522, CASA, CENTRO, 57290000",35531747
Alagoas,AL,27,Porto Real do Colégio,2707503,Leste Alagoano,3,ESCOLA MUNICIPAL DE DUCACAO INFANTIL MARIA PUREZA CALAZANS,27047989,3,1,1,,1,1,"RUA BARAO DO RIO BRANCO, S/N, , CENTRO, 57290000",35531603
Alagoas,AL,27,Porto Real do Colégio,2707503,Leste Alagoano,3,ESCOLA MUNICIPAL DE EDUCACAO INFANTIL DOM PEDRO II,27218520,3,1,1,,1,1,"RUA BARAO RIO BRANCO, S/N, , CENTRO, 57290000",35531192
Alagoas,AL,27,Porto Real do Colégio,2707503,Leste Alagoano,3,ESCOLA MUNICIPAL DE ENSINO FUNDAMENTAL Mª DA CONCEICAO DE BARROS TELES SILVA,27218538,3,1,1,,1,1,"RODOVIA FRANCISCO DE ASSIS SILVA, S/N, PREDIO, CENTRO, 57290000",996540197
Alagoas,AL,27,Porto Real do Colégio,2707503,Leste Alagoano,3,ESCOLA MUNICIPAL DE EDUCACAO BASICA MARIA ROSA DE JESUS,27219739,3,2,1,,1,1,"POVOADO RETIRO I, S/N, ZONA RURAL, , 57290000",35531192
Alagoas,AL,27,Porto Real do Colégio,2707503,Leste Alagoano,3,ESCOLA MUNICIPAL DE EDUCACAO BASICA ESTUDANTE LEANDRO DE ALMEIDA FERREIRA,27225836,3,2,2,,,,"PROJETO ITIUBA, , , , 57290000",35531603
Alagoas,AL,27,Porto Real do Colégio,2707503,Leste Alagoano,3,ESCOLA MUNICIPAL DE EDUCACAO BASICA CLAUDETE DANTAS DE CASTRO,27225933,3,2,2,,,,"POVOADO CURRAL DE DENTRO, S/N, , , 57290000",35531603
Alagoas,AL,27,Porto Real do Colégio,2707503,Leste Alagoano,3,ESCOLA MUNICIPAL DE EDUCACAO BASICA PREFEITO JOSE PACHECO DA SILVA,27226581,3,2,2,,,,"POVOADO TIMBAUBA, , , , 57290000",35531603
Alagoas,AL,27,Quebrangulo,2707602,Agreste Alagoano,2,CENTRO MUNICIPAL DE EDUCACAO INFANTIL AUTA BARROS TENORIO,27015491,3,2,2,,,,"DISTRITO DE RUA NOVA, SN, , ZONA RURAL, 57750000",999299675
Alagoas,AL,27,Quebrangulo,2707602,Agreste Alagoano,2,ESCOLA MUNICIPAL DE EDUCACAO BASICA SAO FRANCISCO,27015505,3,2,2,,,,"POVOADO VILA SAO FRANCISCO, SN, , ZONA RURAL, 57750000",32881648
Alagoas,AL,27,Quebrangulo,2707602,Agreste Alagoano,2,ESCOLA MUL DE EDUC BAS JOVELINA SALDANHA DA C LIMA,27015530,3,1,1,,1,1,"RUA SANTA BERNADETE, S/N, , CENTRO, 57750000",
Alagoas,AL,27,Quebrangulo,2707602,Agreste Alagoano,2,ESCOLA MUNICIPAL DE EDUCACAO BASICA CRISTINO PACIENTE VEIGA,27015696,3,2,1,,1,1,"FAZENDA LAGOA QUEIMADA, S/N, , ZONA RURAL, 57750000",998435286
Alagoas,AL,27,Quebrangulo,2707602,Agreste Alagoano,2,ESCOLA MUNICIPAL DE EDUCACAO BASICA RODRIGO JACINTO TENORIO,27015718,3,2,1,,1,1,"FAZENDA RIACHAO DE BAIXO, S/N, , ZONA RURAL, 57750000",996548815
Alagoas,AL,27,Quebrangulo,2707602,Agreste Alagoano,2,ESCOLA MUNICIPAL DE EDUCACAO BASICA DESEMBARGADOR TENORIO,27047903,3,1,1,,1,3,"AVENIDA 15 DE NOVEMBRO, 214, , CENTRO, 57750000",982187995
Alagoas,AL,27,Quebrangulo,2707602,Agreste Alagoano,2,ESCOLA MUNICIPAL DE EDUCACAO BASICA 16 DE MARCO,27048683,3,1,1,,1,1,"RUA JUSCELINO HOLANDA CAVALCANTE, SN, CJ FREDERICO M. FILH, CENTRO, 57750000",
Alagoas,AL,27,Quebrangulo,2707602,Agreste Alagoano,2,CENTRO MUNICIPAL DE EDUCACAO INFANTIL JOAO PAULO II,27050165,3,1,1,,1,1,"CONJUNTO RESIDENCIAL GERALDO PASSOS LIMA, SN, , CENTRO, 57750000",996471414
Alagoas,AL,27,Quebrangulo,2707602,Agreste Alagoano,2,ESCOLA MUNICIPAL PROFESSORA MIRTA CORREIA COSTA,27226395,3,2,1,,1,1,"AVENIDA CREUZA LAURINDO MAIA, S/Nº, , CENTRO, 57750000",981422453
Alagoas,AL,27,Quebrangulo,2707602,Agreste Alagoano,2,ESCOLA ESTADUAL PROFA ELZA SOARES CAVALCANTE,27226808,2,1,1,,1,1,"RUA PREFEITO JOAO HONORIO DE CARVALHO, SN, , CENTRO, 57750000",996409424
Alagoas,AL,27,Rio Largo,2707701,Leste Alagoano,3,ESCOLA ESTADUAL ROSALVO RIBEIRO,27038629,2,1,1,,1,1,"CONJUNTO RESIDENCIAL JARBAS OITICICA, S/N, QUADRA G -1, MATA DO ROLO, 57100000",993179669
Alagoas,AL,27,Rio Largo,2707701,Leste Alagoano,3,COLEGIO MUNICIPAL JUDITH PAIVA,27040119,3,1,1,,1,1,"AV ALBERTO SANTOS DUMONT, S/N, , CENTRO, 57100000",
Alagoas,AL,27,Rio Largo,2707701,Leste Alagoano,3,ESCOLA ESTADUAL FERNANDINA MALTA,27040240,2,1,1,,1,1,"AV ALBERTO SANTOS DUMONT, SN, , CENTRO, 57100000",988830975
Alagoas,AL,27,Rio Largo,2707701,Leste Alagoano,3,ESCOLA MUNICIPAL DE ENSINO FUNDAMENTAL PROFESSORA EVANDA CARNEIRO DE VASCONCELOS,27040259,3,1,1,,1,1,"RUA SAO JOSE, S/N, ALTO DO GINASIO, CENTRO, 57100000",32612964
Alagoas,AL,27,Rio Largo,2707701,Leste Alagoano,3,CMEI PROFESSOR JOAO FERREIRA DA ROCHA,27040267,3,1,1,,1,1,"CONJ. BOSQUE DOS PALMARES, S/N, QUADRA H, PREFEITO ANTONIO LINS DE SOUZA, 57100000",988742401
Alagoas,AL,27,Rio Largo,2707701,Leste Alagoano,3,EMEF ESMERALDA FIGUEIREDO,27040283,3,1,2,,,,"LOTEAMENTO VILA RICA, S/N, , MATA DO ROLO, 57100000",996579699
Alagoas,AL,27,Rio Largo,2707701,Leste Alagoano,3,EMEB JOAO PAULO II,27040291,3,1,1,,1,1,"AVENIDA SAO MIGUEL, S/N, , ALTO SAO MIGUEL, 57100000",993974816
Alagoas,AL,27,Rio Largo,2707701,Leste Alagoano,3,ESCOLA DE ENSINO FUND JOSE GOMES DA SILVA,27040305,3,2,2,,,,"NAO LOCALIZADO, , , , 57100000",32185328
Alagoas,AL,27,Rio Largo,2707701,Leste Alagoano,3,EMEB MARIETA LEAO,27040313,3,2,1,,1,3,"PATIO DA ESTACAO FERROVIARIA, S/N, , UTINGA LEAO, 57100000",32185328
Alagoas,AL,27,Rio Largo,2707701,Leste Alagoano,3,ESCOLA ESTADUAL SANTOS DUMONT,27040348,2,2,1,,1,1,"DESTACAMENTO DA FAB, SN, VILA MILITAR, TABULEIRO DO PINTO, 57100000",33524279
Alagoas,AL,27,Rio Largo,2707701,Leste Alagoano,3,EMEB D PEDRO I,27040488,3,1,1,,1,1,"RUA CURITIBA, S/N, , PREF. ANTONIO L. DE SOUZA, 57100000",996134230
Alagoas,AL,27,Rio Largo,2707701,Leste Alagoano,3,ESCOLA MUNICIPAL DE ENSINO FUNDAMENTAL DR GASTAO OITICICA,27040500,3,1,1,,1,1,"AV INTENDENTE JULIO CALHEIROS, S/N, VILA MARILIA, MATA DO ROLO, 57100000",32612971
Alagoas,AL,27,Rio Largo,2707701,Leste Alagoano,3,ESCOLA DE ENSINO FUND JOSE LOPES ACIOLI,27040518,3,2,2,,,,"NAO LOCALIZADO, , , , 57100000",
Alagoas,AL,27,Rio Largo,2707701,Leste Alagoano,3,ESCOLA DE EDUCACAO INFANTIL MAGNOLIA COUTINHO,27040534,3,1,2,,,,"NAO LOCALIZADO, , , , 57100000",32612966
Alagoas,AL,27,Rio Largo,2707701,Leste Alagoano,3,EMEF PROFESSOR JOSE EDMILSON DE SOUZA,27040542,3,1,1,,1,1,"LOTEAMENTO PARQUE IMPERIAL,SN, S/N, BAR NOSSO, PREFEITO ANTONIO LINS DE SOUZA, 57100000",998104579
Alagoas,AL,27,Rio Largo,2707701,Leste Alagoano,3,EMEF PROFESSORA EMILIA MILONES,27040577,3,1,1,,1,2,"CONJUNTO MARGARIDA PROCOPIO, 4, QD K, BRASIL NOVO, 57100000",988358402
Alagoas,AL,27,Rio Largo,2707701,Leste Alagoano,3,EMEB RENATO JARSEN DE MELO,27040593,3,1,1,,1,1,"R. VERDE VIVO, S/N, , PREFEITO ANTONIO LINS DE SOUZA, 57100000",33524278
Alagoas,AL,27,Rio Largo,2707701,Leste Alagoano,3,ESCOLA ESTADUAL PROFª DORALICE DA SILVA MOURA,27040607,2,2,1,,1,1,"LOTEAMENTO SANTA MARIA, SN, , MATA DO ROLO, 57100000",991222762
Alagoas,AL,27,Rio Largo,2707701,Leste Alagoano,3,EMEB JOSE BONIFACIO DE ANDRADA E SILVA,27040674,3,1,1,,1,1,"RUA JOSE VIEIRA GOMES, SN, , MATA DO ROLO, 57100000",32612975
Alagoas,AL,27,Rio Largo,2707701,Leste Alagoano,3,ESCOLA MUNICIPAL DE EDUCACAO BASICA ADELAIDE OITICICA LINS,27040712,3,2,2,,,,"RUA SANTA HELENA, 69, , FAZENDA CANOAS, 57100000",32491105
Alagoas,AL,27,Rio Largo,2707701,Leste Alagoano,3,EMEF INDUSTRIAL LUIGI BAUDUCCO,27040720,3,1,1,,1,1,"CONJNTO CRUZEIRO DO SUL, QD A 02, SN, , BRASIL NOVO, 57100000",981229169
Alagoas,AL,27,Rio Largo,2707701,Leste Alagoano,3,EMEB DALMARIO SOUZA,27040739,3,1,1,,1,1,"RUA ALTO DA SAUDADE, SN, , LOURENCO DE ALBUQUERQUE, 57100000",996480025
Alagoas,AL,27,Rio Largo,2707701,Leste Alagoano,3,EMEB DR GUSTAVO PAIVA,27040747,3,1,1,,1,1,"CONJUNTO BARNABE OITICICA, SN, , MATA DO ROLO, 57100000",88451519
Alagoas,AL,27,Rio Largo,2707701,Leste Alagoano,3,ESCOLA ESTADUAL FRANCISCO LEAO,27040755,2,2,1,,1,1,"CONJUNTO RESIDENCIAL BARNABE OITICICA, SN, , MATA DO ROLO, 57100000",
Alagoas,AL,27,Rio Largo,2707701,Leste Alagoano,3,ESCOLA ESTADUAL JOAO MORAIS CAVALCANTE,27040771,2,1,1,,1,1,"CONJUNTO HABITACIONAL JOSE FERNANDES TORRES, SN, MUTIRAO, CENTRO, 57100000",
Alagoas,AL,27,Rio Largo,2707701,Leste Alagoano,3,EMEF MACHADO DE ASSIS,27040798,3,1,1,,1,1,"AV. INTENDENTE JULIO CALHEIROS, 380, VILA MARILIA, MATA DO ROLO, 57100000",
Alagoas,AL,27,Rio Largo,2707701,Leste Alagoano,3,EMEB MANOEL SOARES DE SOUZA,27040801,3,1,1,,1,1,"AVENIDA TEOTONIO BRANDAO VILELA, S/N, , MATA DO ROLO, 57100000",993187338
Alagoas,AL,27,Rio Largo,2707701,Leste Alagoano,3,EMEB TERESA CRISTINA LINS DE SOUZA COSTA,27040810,3,1,1,,1,1,"RESIDENCIAL FRANCISCO TAVARES GRANJA, S/N, ESCOLA, MATA DO ROLO, 57100000",988586357
Alagoas,AL,27,Rio Largo,2707701,Leste Alagoano,3,ESCOLA MUNICIPAL DE ENSINO FUNDAMENTAL ODYLO ALVARES DE SOUZA,27040828,3,1,1,,1,1,"AVENIDA MUNIZ FALCAO, S/N, , CENTRO, 57100000",
Alagoas,AL,27,Rio Largo,2707701,Leste Alagoano,3,ESCOLA ESTADUAL OZORIA DE MOURA LIMA,27040836,2,1,1,,1,1,"RUA ANTONIO ELIAS CALHEIROS, SN, , LOURENCO DE ALBUQUERQUE, 57100000",988231224
Alagoas,AL,27,Rio Largo,2707701,Leste Alagoano,3,CMEI PROFESSOR DERALDO CAMPOS,27040844,3,1,1,,1,1,"AV. MUNIZ FALCAO, SN, , CENTRO, 57100000",988547852
Alagoas,AL,27,Rio Largo,2707701,Leste Alagoano,3,EMEB PROFESSOR POMPEU SARMENTO,27040852,3,1,1,,1,1,"RUA PEDRO COUTINHO, SN, , CENTRO, 57100000",32612972
Alagoas,AL,27,Rio Largo,2707701,Leste Alagoano,3,ESCOLA ESTADUAL TABULEIRO DO PINTO,27040860,2,2,1,,1,1,"RUA JOSE MONTEIRO DE MELO, SN, , TABULEIRO DO PINTO, 57100000",
Alagoas,AL,27,Rio Largo,2707701,Leste Alagoano,3,ESCOLA DE ENSINO FUNDAMENTAL SANTA CLOTILDE,27040879,3,2,2,,,,"USINA SANTA CLOTILDE, SN, , , 57100000",32492091
Alagoas,AL,27,Rio Largo,2707701,Leste Alagoano,3,CMEI PROFESSOR AQUINO COSTA JAPIASSU,27040909,3,1,1,,1,1,"AV INT JULIO CALHEIROS, SN, VILA MARILIA, MATA DO ROLO, 57100000",
Alagoas,AL,27,Rio Largo,2707701,Leste Alagoano,3,EMEB PROFESSORA IETE MELO MATHIAS,27049191,3,1,1,,1,1,"TRAVESSA MATADOURO, SN, MUTIRAO, CENTRO, 57100000",988744815
Alagoas,AL,27,Rio Largo,2707701,Leste Alagoano,3,IFAL - CAMPUS RIO LARGO,27050564,1,1,1,,1,3,"RODOVIA BR 104 KM 91, S/Nº, , PREFEITO ANTONIO LINS DE SOUZA, 57100000",21266372
Alagoas,AL,27,Rio Largo,2707701,Leste Alagoano,3,CMEI PROFESSORA RAILZA COSTA BARROS,27051862,3,1,1,,1,1,"RESIDENCIAL JARBAS OITICICA, S/N, Q. D 05, MATA DO ROLO, 57100000",993702494
Alagoas,AL,27,Rio Largo,2707701,Leste Alagoano,3,CMEI PROFESSORA MARIA JOSE BATISTA DA SILVA,27052265,3,1,1,,1,2,"CONJUNTO MARGARIDA PROCOPIO, 13, QUADRA N, BRASIL NOVO, 57100000",
Alagoas,AL,27,Rio Largo,2707701,Leste Alagoano,3,CMEI PEDRO SOARES CAVALCANTE,27052710,3,1,1,,1,1,"RESIDENCIAL TEOTONIO BRANDAO VILELA, S/N, RUA 16 QUADRA H, MATA DO ROLO, 57100000",981612694
Alagoas,AL,27,Rio Largo,2707701,Leste Alagoano,3,CRECHE MUNICIPAL JUARINA PINTO DA SILVA,27052729,3,1,1,,1,1,"PARQUE SANTA TEREZA, S/N, QD G, TABULEIRO DO PINTO, 57100000",
Alagoas,AL,27,Rio Largo,2707701,Leste Alagoano,3,CRECHE MUNICIPAL VOVO OZANA BEDA,27052737,3,1,1,,1,1,"LOTEAMENTO FRANCISCO TAVARES GRANJA, S/N, QUADRA D 10 RUA J, MATA DO ROLO, 57100000",82930300
Alagoas,AL,27,Rio Largo,2707701,Leste Alagoano,3,CRECHE MUNICIPAL DR CELYRIO ADAMASTOR BARRETO ACCIOLY,27053350,3,1,1,,1,1,"CONJ EDSON NOVAES, S/N, ATRAS DO FORUM, GUSTAVO PAIVA, 57100000",996003176
Alagoas,AL,27,Rio Largo,2707701,Leste Alagoano,3,CENTRO MUNICIPAL DE EDUCACAO INFANTIL DESEMBARGADOR FRANCISCO WILDO LACERDA DANTAS,27053709,3,1,1,,1,1,"CONJUNTO ANTONIO LINS DE SOUZA, S/N, , MATO DO ROLO, 57100000",988798614
