NO_UF,SG_UF,CO_UF,nome_municipio,id_municipio,nome_mesorregiao,id_mesorregiao,nome_escola,id_escola,dependencia,localizacao,funcionamento,sede,alocacao,ocupacao,endereco,telefone
Alagoas,AL,27,Feira Grande,2702603,Agreste Alagoano,2,ESCOLA MUNICIPAL DE ENSINO FUNDAMENTAL EM TEMPO INTEGRAL MANOEL HONORIO BISPO,27018539,3,2,1,,1,1,"POVOADO MUMBACA, , ESCOLA, ZONA RURAL, 57340000",
Alagoas,AL,27,Feira Grande,2702603,Agreste Alagoano,2,ESCOLA MUNICIPAL DE ENSINO FUNDAMENTAL PRINCESA ISABEL,27018547,3,2,2,,,,"POVOADO OLHO DAGUA DO MANDACARU, , ESCOLA, ZONA RURAL, 57340000",
Alagoas,AL,27,Feira Grande,2702603,Agreste Alagoano,2,ESCOLA MUNICIPAL DE ENSINO FUNDAMENTAL NOSSA SENHORA DE LOURDES,27018580,3,2,2,,,,"SITIO OITI, , ESCOLA, ZONA RURAL, 57340000",
Alagoas,AL,27,Feira Grande,2702603,Agreste Alagoano,2,ESCOLA MUNICIPAL DE ENSINO FUNDAMENTAL SETE DE SETEMBRO,27018601,3,1,1,,1,1,"RUA 07 DE SETEMBRO, 132, , CENTRO, 57340000",982033253
Alagoas,AL,27,Feira Grande,2702603,Agreste Alagoano,2,ESCOLA MUNICIPAL DE ENSINO FUNDAMENTAL 1º DE MAIO,27018610,3,2,2,,,,"SITIO MACAMBIRA, , , , 57340000",
Alagoas,AL,27,Feira Grande,2702603,Agreste Alagoano,2,ESCOLA MUNICIPAL DE ENSINO FUNDAMENTAL 9 DE JANEIRO,27018636,3,2,1,,1,1,"SITIO TABOCA, , ZONA RURAL, , 57340000",999784766
Alagoas,AL,27,Feira Grande,2702603,Agreste Alagoano,2,ESCOLA MUNICIPAL DE ENSINO FUNDAMENTAL ARARIBOIA,27018644,3,2,1,,1,1,"POVOADO OLHO DAGUA DO MEIO, S/N, , ZONA RURAL, 57340000",35241393
Alagoas,AL,27,Feira Grande,2702603,Agreste Alagoano,2,ESCOLA MUNICIPAL DE ENSINO FUNDAMENTAL DOM PEDRO I,27018652,3,2,1,,1,1,"POVOADO OLHO DAGUA DO MEIO, S/N, , ZONA RURAL, 57340000",35241285
Alagoas,AL,27,Feira Grande,2702603,Agreste Alagoano,2,ESCOLA MUNICIPAL DE ENSINO FUNDAMENTAL EM TEMPO INTEGRAL DIVALDO SURUAGY,27018660,3,2,1,,1,1,"POVOADO VARZINHA, , , ZONA RURAL, 57340000",
Alagoas,AL,27,Feira Grande,2702603,Agreste Alagoano,2,ESCOLA MUNICIPAL DE ENSINO FUNDAMENTAL JAYME LUSTOSA DE ALTAVILA,27018679,3,2,1,,1,1,"SITIO NOVO, S/N, , ZONA RURAL, 57340000",35241285
Alagoas,AL,27,Feira Grande,2702603,Agreste Alagoano,2,ESCOLA MUNICIPAL DE ENSINO FUNDAMENTAL JOAO CRISOSTOMO MACHADO,27018687,3,2,2,,,,"POVOADO POCO VERDE, , ESCOLA, ZONA RURAL, 57340000",
Alagoas,AL,27,Feira Grande,2702603,Agreste Alagoano,2,ESCOLA MUNICIPAL DE ENSINO FUNDAMENTAL MURILO DA ROCHA MENDES,27018709,3,2,1,,1,1,"SITIO SANTANA DE CIMA, , , , 57340000",982033253
Alagoas,AL,27,Feira Grande,2702603,Agreste Alagoano,2,ESCOLA MUNICIPAL DE ENSINO FUNDAMENTAL RUI BARBOSA,27018725,3,2,2,,,,"SITIO ESPINHEIRO, , ESCOLA, ZONA RURAL, 57340000",
Alagoas,AL,27,Feira Grande,2702603,Agreste Alagoano,2,ESCOLA MUNICIPAL DE ENSINO FUNDAMENTAL SAO FRANCISCO DE ASSIS,27018733,3,2,2,,,,"TABOCAL 1, , CASA, ZONA RURAL, 57340000",
Alagoas,AL,27,Feira Grande,2702603,Agreste Alagoano,2,ESCOLA MUNICIPAL DE ENSINO FUNDAMENTAL ALBERTO SANTOS DUMONT,27018750,3,2,2,,,,"SITIO CANDARA, S/N, , ZONA RURAL, 57340000",35241285
Alagoas,AL,27,Feira Grande,2702603,Agreste Alagoano,2,ESCOLA MUNICIPAL DE ENSINO FUNDAMENTAL AYRTON SENNA DA SILVA,27214648,3,2,2,,,,"SITIO JABOTICABA, , , , 57340000",981435159
Alagoas,AL,27,Feira Grande,2702603,Agreste Alagoano,2,ESCOLA MUNICIPAL DE ENSINO FUNDAMENTAL JAIR CARVALHO DE LIRA,27217663,3,2,2,,,,"POVOADO TABOCAL 2, , , , 57340000",
Alagoas,AL,27,Feira Grande,2702603,Agreste Alagoano,2,ESCOLA MUNICIPAL DE ENSINO FUNDAMENTAL ANIZIO JOSE DE LIRA,27224180,3,2,1,,1,1,"POVOADO CABACEIRAS, , , ZONA RURAL, 57340000",999253907
Alagoas,AL,27,Feira Grande,2702603,Agreste Alagoano,2,CENTRO MUNICIPAL DE EDUCACAO INFANTIL TEREZINHA RODRIGUES LIRA,27225275,3,1,1,,1,1,"TREZE DE MAIO, SN, , CENTRO, 57340000",999621593
Alagoas,AL,27,Feliz Deserto,2702702,Leste Alagoano,3,ESCOLA ESTADUAL SENADOR ARNON DE MELLO,27044726,2,1,1,,1,1,"PRACA DOMINGOS MENDES, 195, , CENTRO, 57220000",
Alagoas,AL,27,Feliz Deserto,2702702,Leste Alagoano,3,ESCOLA MUNICIPAL DE EDUCACAO BASICA HEVYTON ALVES POSSIDONIO,27044750,3,1,1,,1,1,"RUA DOUTOR GETULIO VARGAS, S/N, , CENTRO, 57220000",
Alagoas,AL,27,Feliz Deserto,2702702,Leste Alagoano,3,ESCOLA MUNICIPAL DE EDUCACAO BASICA VEREADOR ANTONIO CAETANO DE MELO,27044769,3,2,1,,1,1,"POVOADO PONTES, SN, , ZONA RURAL, 57220000",35561361
Alagoas,AL,27,Feliz Deserto,2702702,Leste Alagoano,3,ESCOLA MUNICIPAL DE EDUCACAO BASICA JOAO MANUEL MUNIZ SIMOES,27222586,3,1,1,,1,1,"AVENIDA DOUTOR MUNIZ FALCAO, 357, , CENTRO, 57220000",35561313
Alagoas,AL,27,Feliz Deserto,2702702,Leste Alagoano,3,ESCOLA MUNICIPAL DE EDUCACAO INFANTIL VEREADOR LUIZ DE FRANCA NUNES,27230716,3,1,1,,1,1,"RUA DOMINGOS ANDRE, S/N, , CENTRO, 57220000",
Alagoas,AL,27,Flexeiras,2702801,Leste Alagoano,3,ESCOLA MUNICIPAL DE ENSINO FUNDAMENTAL NOSSA SENHORA DA CONCEICAO,27028178,3,2,1,,1,1,"RUA DOS MOTORISTAS -POVOADO PEIXE - FLEXEIRAS/ALAGOAS, S/N, ANTIGA USINA PEIXE, ZONA RURAL, 57995000",982117567
Alagoas,AL,27,Flexeiras,2702801,Leste Alagoano,3,ESCOLA MUNICIPAL DE EDUCACAO INFANTIL PROFESSORA LEONOR CARVALHO MARINHO,27028186,3,1,1,,1,1,"RUA PROFESSORA MARIA ISABEL COSTA SOUZA, S/N, , CENTRO, 57995000",993166335
Alagoas,AL,27,Flexeiras,2702801,Leste Alagoano,3,ESCOLA MUNICIPAL DE ENSINO FUNDAMENTAL MARCOS AURELIO LINS PINHEIRO,27028232,3,2,2,,,,"FAZENDA NOSSA SENHORA APARECIDA, , , ZONA RURAL, 57995000",32561393
Alagoas,AL,27,Flexeiras,2702801,Leste Alagoano,3,ESCOLA MUNICIPAL DE ENSINO FUNDAMENTAL DR JARBAS MAYA DE OMENA,27028305,3,1,1,,1,1,"RUA CORONEL ALCANTARA, S/N, , CENTRO, 57995000",
Alagoas,AL,27,Flexeiras,2702801,Leste Alagoano,3,ESCOLA MUNICIPAL DE ENSINO FUNDAMENTAL JOAO CORDEIRO SOUZA JUNIOR,27028313,3,2,2,,,,"FAZENDA CAFUNDO, , , ZONA RURAL, 57995000",32561393
Alagoas,AL,27,Flexeiras,2702801,Leste Alagoano,3,ESCOLA MUNICIPAL DE ENSINO FUNDAMENTAL SAO BENEDITO,27028356,3,2,2,,,,"FAZENDA AMOLAR, , , ZONA RURAL, 57995000",32561393
Alagoas,AL,27,Flexeiras,2702801,Leste Alagoano,3,ESCOLA MUNICIPAL DE ENSINO FUNDAMENTAL MARIA DAS MERCES GOMES FRAGOSO,27028364,3,2,1,,1,1,"FAZENDA NOVA VIDA, , , ZONA RURAL, 57995000",32561393
Alagoas,AL,27,Flexeiras,2702801,Leste Alagoano,3,ESCOLA MUNICIPAL DE ENSINO FUNDAMENTAL RIO BONITO,27048829,3,2,2,,,,"ASSENTAMENTO RIO BONITO, , , ZONA RURAL, 57995000",32561393
Alagoas,AL,27,Flexeiras,2702801,Leste Alagoano,3,ESCOLA MUNICIPAL DE ENSINO FUNDAMENTAL SENADOR BENEDITO DE LIRA,27051897,3,1,1,,1,1,"RUA PROFESSORA ISABEL COSTA SOUZA, S/N, , CENTRO, 57995000",32561393
Alagoas,AL,27,Flexeiras,2702801,Leste Alagoano,3,ESCOLA MUNICIPAL DE EDUCACAO INFANTIL ANTONIA CAVALCANTE DE ALMEIDA,27214257,3,1,1,,1,1,"RUA CORONEL ALCANTARA, SN, , CENTRO, 57995000",32561393
Alagoas,AL,27,Flexeiras,2702801,Leste Alagoano,3,ESCOLA MUNICIPAL DE ENSINO FUNDAMENTAL DELCIO VERCOSA DE AMORIM,27214354,3,1,1,,1,1,"AV.ROSITA CALHEIROS CAVALCANTE, S/N, , CONJUNTO EMILIO MAYA, 57995000",32561245
Alagoas,AL,27,Flexeiras,2702801,Leste Alagoano,3,ESCOLA MUNICIPAL DE ENSINO FUNDAMENTAL FLORA CAVALCANTE,27219194,3,2,1,,1,1,"FAZENDA LARANJEIRAS, , , ZONA RURAL, 57995000",32561393
Alagoas,AL,27,Flexeiras,2702801,Leste Alagoano,3,ESCOLA MUNICIPAL DE ENSINO FUNDAMENTAL GUILHERME CALHEIROS,27221075,3,1,1,,1,1,"RUA CORONEL ALCANTARA, S/N, , CENTRO, 57995000",991102585
Alagoas,AL,27,Flexeiras,2702801,Leste Alagoano,3,CRECHE MUNICIPAL EUCLIDES MARINHO MAGALHAES,27224430,3,1,1,,1,1,"AVENIDA ROSITA CALHEIROS CAVALCANTE, S/N, , CENTRO, 57995000",
Alagoas,AL,27,Girau do Ponciano,2702900,Agreste Alagoano,2,ESCOLA MUNICIPAL DE EDUCACAO BASICA GOVERNADOR GERALDO BULHOES,27018768,3,2,1,,1,1,"DISTRITO CANAFISTULA DO CIPRIANO, S/N, , ZONA RURAL, 57360000",35201459
Alagoas,AL,27,Girau do Ponciano,2702900,Agreste Alagoano,2,ESCOLA MUNICIPAL DE EDUCACAO BASICA DR LUIS EUSTAQUIO TOLEDO,27018776,3,2,2,,,,"GIRAU DO PONCIANO, , , , 57360000",
Alagoas,AL,27,Girau do Ponciano,2702900,Agreste Alagoano,2,ESCOLA MUNICIPAL DE EDUCACAO BASICA ANTONIO FERREIRA DE ANDRADE,27018792,3,2,1,,1,1,"SITIO PITUBAS, SN, , ZONA RURAL, 57360000",35201459
Alagoas,AL,27,Girau do Ponciano,2702900,Agreste Alagoano,2,ESCOLA DE 1º GRAU DEP FERNANDO COLLOR DE MELLO,27018806,3,2,2,,,,"GIRAU DO PONCIANO, , , , 57360000",
Alagoas,AL,27,Girau do Ponciano,2702900,Agreste Alagoano,2,COMPLEXO MUNICIPAL DE EDUCACAO BASICA DEPUTADO JOSE MEDEIROS,27018814,3,1,1,,1,1,"RUA DOUTOR JOSE BENTO, S/N, , SAO TARCISIO, 57360000",999001078
Alagoas,AL,27,Girau do Ponciano,2702900,Agreste Alagoano,2,ESCOLA MUNICIPAL DE EDUCACAO BASICA GETULIO VARGAS,27018822,3,2,1,,1,1,"POVOADO JABOTICABA, SN, PREDIO, ZONA RURAL, 57360000",35201842
Alagoas,AL,27,Girau do Ponciano,2702900,Agreste Alagoano,2,ESCOLA MUNICIPAL DE EDUCACAO BASICA JORGE AMADO,27018849,3,2,1,,1,1,"POVOADO ALMAS, SN, PREDIO, ZONA RURAL, 57360000",35201842
Alagoas,AL,27,Girau do Ponciano,2702900,Agreste Alagoano,2,ESCOLA MUNICIPAL DE EDUCACAO BASICA SENADOR ARNON DE MELO,27018857,3,2,1,,1,1,"POVOADO LAGOA DO MEL, SN, , ZONA RURAL, 57360000",35201459
Alagoas,AL,27,Girau do Ponciano,2702900,Agreste Alagoano,2,ESCOLA DE 1º GRAU DARCY DOS SANTOS SILVA,27018865,3,2,2,,,,"GIRAU DO PONCIANO, , , , 57360000",
Alagoas,AL,27,Girau do Ponciano,2702900,Agreste Alagoano,2,ESCOLA MUNICIPAL DE EDUCACAO BASICA PROFESSORA DINAIR DOS SANTOS COSTA,27018873,3,2,1,,1,1,"POVOADO MATA VERMELHA, SN, PREDIO, ZONA RURAL, 57360000",35201459
Alagoas,AL,27,Girau do Ponciano,2702900,Agreste Alagoano,2,ESCOLA MUNICIPAL DE EDUCACAO BASICA JOAO FRANCISCO DE BRITO,27018881,3,2,1,,1,1,"POVOADO CARNUDOS, SN, , ZONA RURAL, 57360000",35201842
Alagoas,AL,27,Girau do Ponciano,2702900,Agreste Alagoano,2,ESCOLA MUNICIPAL DE EDUCACAO BASICA MARIA LELICE GOMES BARROS,27018890,3,2,1,,1,1,"POVOADO CAMPESTRE I, SN, , ZONA RURAL, 57360000",35201459
Alagoas,AL,27,Girau do Ponciano,2702900,Agreste Alagoano,2,ESCOLA DE 1º GRAU MARIA LEONISA DOS SANTOS,27018903,3,2,2,,,,"GIRAU DO PONCIANO, , , , 57360000",
Alagoas,AL,27,Girau do Ponciano,2702900,Agreste Alagoano,2,ESCOLA MUNICIPAL DE EDUCACAO BASICA MINISTRO JOSE GOLDEMBERG,27018911,3,2,2,,,,"GIRAU DO PONCIANO, , , , 57360000",35201842
Alagoas,AL,27,Girau do Ponciano,2702900,Agreste Alagoano,2,ESCOLA MUNICIPAL DE EDUCACAO BASICA PE JOSE BATISTA DE AZEVEDO,27018920,3,2,1,,1,1,"POVOADO SERRINHA I, SN, , ZONA RURAL, 57360000",35201459
Alagoas,AL,27,Girau do Ponciano,2702900,Agreste Alagoano,2,ESCOLA MUNICIPAL DE EDUCACAO BASICA ANTONIO IZIDORO DE FARIAS,27018938,3,2,1,,1,1,"POVOADO LAGOA GRANDE DO JATOBA, SN, , ZONA RURAL, 57360000",996618214
Alagoas,AL,27,Girau do Ponciano,2702900,Agreste Alagoano,2,ESCOLA MUNICIPAL DE EDUCACAO BASICA DENILMA BULHOES,27018946,3,2,1,,1,1,"POVOADO LAGOINHA, S/N, PREDIO, ZONA RURAL, 57360000",
Alagoas,AL,27,Girau do Ponciano,2702900,Agreste Alagoano,2,ESCOLA MUNICIPAL DE EDUCACAO BASICA JOAO JOSE DE FARIAS,27018954,3,2,1,,1,1,"POVOADO BARBOSA, S/N, , ZONA RURAL, 57360000",35201842
Alagoas,AL,27,Girau do Ponciano,2702900,Agreste Alagoano,2,ESCOLA ESTADUAL OLIMPIA TENORIO LIMA,27018962,2,1,1,,1,1,"PRACA PRESIDENTE KENNEDY, 86, PREDIO, CENTRO, 57360000",
Alagoas,AL,27,Girau do Ponciano,2702900,Agreste Alagoano,2,ESCOLA MUNICIPAL DE EDUCACAO BASICA PROFº RIVO FARIAS,27018970,3,2,1,,1,1,"POVOADO LAGOA DAS PIABAS, SN, , ZONA RURAL, 57360000",981172677
Alagoas,AL,27,Girau do Ponciano,2702900,Agreste Alagoano,2,ESCOLA MUNICIPAL DE EDUCACAO BASICA GETULIO DE ALMEIDA CABRAL,27018989,3,2,1,,1,1,"POVOADO BALANCAS, SN, , ZONA RURAL, 57360000",
Alagoas,AL,27,Girau do Ponciano,2702900,Agreste Alagoano,2,E E E B JOSE ENOQUE DE BARROS,27018997,2,2,1,,1,1,"POVOADO DE CANAFISTULA DO CIPRIANO, SN, , ZONA RURAL, 57360000",981447987
Alagoas,AL,27,Girau do Ponciano,2702900,Agreste Alagoano,2,ESCOLA MUNICIPAL DE EDUCACAO BASICA ANTONIO MONTEIRO DE MELO,27019004,3,2,1,,1,1,"POVOADO ALTO DO UMBUZEIRO, SN, , ZONA RURAL, 57360000",35201459
Alagoas,AL,27,Girau do Ponciano,2702900,Agreste Alagoano,2,GRUPO ESCOLA MUNICIPAL CASTELO BRANCO,27019012,3,2,2,,,,"GIRAU DO PONCIANO, , , , 57360000",
Alagoas,AL,27,Girau do Ponciano,2702900,Agreste Alagoano,2,ESCOLA DE 1º GRAU CASTRO ALVES,27019020,3,2,2,,,,"GIRAU DO PONCIANO, , , , 57360000",
Alagoas,AL,27,Girau do Ponciano,2702900,Agreste Alagoano,2,ESCOLA MUNICIPAL DE EDUCACAO BASICA PADRE CICERO,27019039,3,2,2,,,,"POVOADO EMA, SN, , , 57360000",35201459
Alagoas,AL,27,Girau do Ponciano,2702900,Agreste Alagoano,2,ESCOLA MUNICIPAL DE EDUCACAO BASICA PEDRO ALVARES CABRAL,27019055,3,2,1,,1,1,"POVOADO SALOBRO GRANDE, SN, PREDIO, ZONA RURAL, 57360000",35201459
Alagoas,AL,27,Girau do Ponciano,2702900,Agreste Alagoano,2,ESCOLA MUNICIPAL DE EDUCACAO BASICA PROFESSORA JOANA PINHEIRO,27019063,3,2,1,,1,1,"POVOADO CALDEIROES, S/N, CASA, ZONA RURAL, 57360000",35201459
Alagoas,AL,27,Girau do Ponciano,2702900,Agreste Alagoano,2,ESCOLA MUNICIPAL DE EDUCACAO BASICA SANTA CLARA,27019071,3,2,1,,1,1,"POVOADO RANCHO, SN, PROXIMA A IGREJINHA, ZONA RURAL, 57360000",996492057
Alagoas,AL,27,Girau do Ponciano,2702900,Agreste Alagoano,2,ESCOLA MUNICIPAL DE EDUCACAO BASICA SANTA LUCIA,27019080,3,2,1,,1,1,"POVOADO NICOLAU, SN, PREDIO, ZONA RURAL, 57360000",35201459
Alagoas,AL,27,Girau do Ponciano,2702900,Agreste Alagoano,2,ESCOLA MUNICIPAL DE EDUCACAO BASICA SANTA RITA,27019101,3,2,2,,,,"SITIO BOA SORTE, , , ZONA RURAL, 57360000",
Alagoas,AL,27,Girau do Ponciano,2702900,Agreste Alagoano,2,ESCOLA MUNICIPAL DE EDUCACAO BASICA DEPUTADO ANTONIO HOLANDA,27019110,3,2,1,,1,1,"POVOADO CRAIBAS DOS FERROS, SN, , ZONA RURAL, 57360000",35201459
Alagoas,AL,27,Girau do Ponciano,2702900,Agreste Alagoano,2,CENTRO MUNICIPAL DE EDUCACAO INFANTIL ALCINA MANGUEIRA CANUTO,27019160,3,1,1,,1,1,"RUA JOSE ALEXANDRE, S/N, , CENTRO, 57360000",
Alagoas,AL,27,Girau do Ponciano,2702900,Agreste Alagoano,2,ESCOLA MUNICIPAL DE EDUCACAO BASICA ERNESTO RODRIGUES DE SOUZA,27019179,3,2,2,,,,"POVOADO SERROTE DO JAPAO, SN, , ZONA RURAL, 57360000",35201459
Alagoas,AL,27,Girau do Ponciano,2702900,Agreste Alagoano,2,ESCOLA MUNICIPAL DE EDUCACAO BASICA MANOEL FERREIRA LIMA,27019187,3,2,1,,1,1,"POVOADO LAGOA GRANDE DOS PAULINOS, S/N, , ZONA RURAL, 57360000",
Alagoas,AL,27,Girau do Ponciano,2702900,Agreste Alagoano,2,ESCOLA MUNICIPAL DE EDUCACAO BASICA JOSE PEREIRA BEZERRA,27019195,3,2,1,,1,1,"POVOADO TRAIRAS, SN, , ZONA RURAL, 57360000",99413634
Alagoas,AL,27,Girau do Ponciano,2702900,Agreste Alagoano,2,ESCOLA MUNICIPAL DE EDUCACAO BASICA PADRE AFRANIO PINHEIRO BEZERRA,27019209,3,2,1,,1,1,"POVOADO GENIPAPO, SN, ESCOLA, ZONA RURAL, 57360000",35201459
Alagoas,AL,27,Girau do Ponciano,2702900,Agreste Alagoano,2,ESCOLA MUNICIPAL DE EDUCACAO BASICA PADRE JOSE DE ANCHIETA,27019217,3,2,2,,,,"POVOADO LAGOA GRANDE DOS SOARES, SN, , , 57360000",35201459
Alagoas,AL,27,Girau do Ponciano,2702900,Agreste Alagoano,2,ESCOLA MUNICIPAL DE EDUCACAO BASICA VEREADOR AGOSTINHO SOARES DAMASCENO,27019225,3,2,1,,1,1,"POVOADO MATEUS, SN, CASA, ZONA RURAL, 57360000",35201459
Alagoas,AL,27,Girau do Ponciano,2702900,Agreste Alagoano,2,ESCOLA MUNICIPAL DE EDUCACAO BASICA SAO PEDRO,27019233,3,2,1,,1,1,"POVOADO JACIOBA, S/N, , ZONA RURAL, 57360000",35201459
Alagoas,AL,27,Girau do Ponciano,2702900,Agreste Alagoano,2,ESCOLA MUNICIPAL DE EDUCACAO BASICA TERTULINO BISPO BEZERRA,27019241,3,2,2,,,,"GIRAU DO PONCIANO, SN, , , 57360000",
Alagoas,AL,27,Girau do Ponciano,2702900,Agreste Alagoano,2,ESCOLA MUNICIPAL DE EDUCACAO BASICA DUQUE DE CAXIAS,27019250,3,2,1,,1,1,"POVOADO MALUDA, SN, , ZONA RURAL, 57360000",35201459
Alagoas,AL,27,Girau do Ponciano,2702900,Agreste Alagoano,2,ESCOLA MUNICIPAL DE EDUCACAO BASICA PROFESSORA GENOVEVA MARIA DA COSTA,27019268,3,2,1,,1,1,"POVOADO ALECRIM II, S/N, , ZONA RURAL, 57360000",35201842
Alagoas,AL,27,Girau do Ponciano,2702900,Agreste Alagoano,2,ESCOLA MUNICIPAL DE EDUCACAO BASICA JOSE TAVARES,27019284,3,2,1,,1,1,"POVOADO CHA DO ALECRIM, SN, , ZONA RURAL, 57360000",981172677
Alagoas,AL,27,Girau do Ponciano,2702900,Agreste Alagoano,2,ESCOLA MUNICIPAL DE EDUCACAO BASICA MARECHAL FLORIANO PEIXOTO,27019292,3,2,2,,,,"POVOADO BARRO VERMELHO, SN, , , 57360000",35201459
Alagoas,AL,27,Girau do Ponciano,2702900,Agreste Alagoano,2,ESCOLA MUNICIPAL DE EDUCACAO BASICA JOAQUIM JOSE DA SILVA XAVIER,27019314,3,2,1,,1,1,"POVOADO DESIDERIO, SN, , ZONA RURAL, 57360000",
Alagoas,AL,27,Girau do Ponciano,2702900,Agreste Alagoano,2,ESCOLA MUNICIPAL DE EDUCACAO BASICA MANOEL JOAO NETO,27019322,3,2,2,,,,"POVOADO MATA DAGUA I, SN, PREDIO, ZONA RURAL, 57360000",35201842
Alagoas,AL,27,Girau do Ponciano,2702900,Agreste Alagoano,2,ESCOLA MUNICIPAL DE EDUCACAO BASICA SAO BRAZ,27019357,3,2,1,,1,1,"POVOADO LAGOA DE DENTRO, SN, PREDIO, ZONA RURAL, 57360000",35201459
Alagoas,AL,27,Girau do Ponciano,2702900,Agreste Alagoano,2,ESCOLA MUNICIPAL DE EDUCACAO BASICA SAO CARLOS,27019365,3,2,1,,1,1,"POVOADO MATA DAGUA II, SN, PREDIO, ZONA RURAL, 57360000",35201842
Alagoas,AL,27,Girau do Ponciano,2702900,Agreste Alagoano,2,CENTRO MUNICIPAL DE EDUCACAO INFANTIL SAO FRANCISCO DE ASSIS,27019373,3,2,1,,1,1,"POVOADO ALECRIM I, SN, CASA, ZONA RUAL, 57360000",35201459
Alagoas,AL,27,Girau do Ponciano,2702900,Agreste Alagoano,2,ESCOLA MUNICIPAL DE EDUCACAO BASICA SAO JOSE,27019381,3,2,1,,1,1,"POVOADO POCO, S/N, PREDIO, ZONA RURAL, 57360000",35201459
Alagoas,AL,27,Girau do Ponciano,2702900,Agreste Alagoano,2,ESCOLA MUNICIPAL DE EDUCACAO BASICA SAO LUCAS,27019403,3,2,2,,,,"POVOADO CABACAS, SN, , ZONA RURAL, 57360000",35201459
Alagoas,AL,27,Girau do Ponciano,2702900,Agreste Alagoano,2,CENTRO MUNICIPAL DE EDUCACAO BASICA SANTO AMARO,27019411,3,2,1,,1,1,"POVOADO SAO CRISTOVAO, SN, , ZONA RURAL, 57360000",35201459
Alagoas,AL,27,Girau do Ponciano,2702900,Agreste Alagoano,2,ESCOLA MUNICIPAL DE EDUCACAO BASICA SANTO ANTONIO,27019420,3,2,1,,1,1,"POVOADO BOQUEIRAO DAS PASTORAS, , , ZONA RURAL, 57360000",35201459
Alagoas,AL,27,Girau do Ponciano,2702900,Agreste Alagoano,2,ESCOLA MUNICIPAL DE EDUCACAO BASICA TIRADENTES,27019438,3,1,1,,1,1,"AVENIDA TIRADENTES, 24, PREDIO, CENTRO, 57360000",
Alagoas,AL,27,Girau do Ponciano,2702900,Agreste Alagoano,2,CENTRO MUNICIPAL DE EDUCACAO INFANTIL IMACULADA CONCEICAO,27019446,3,2,1,,1,1,"CANAFISTULA DO CIPRIANO, S/N, PREDIO, ZONA RURAL, 57360000",35201459
Alagoas,AL,27,Girau do Ponciano,2702900,Agreste Alagoano,2,ESCOLA MUNICIPAL DE EDUCACAO BASICA MAJOR VICENTE RAMOS,27019454,3,2,1,,1,1,"POVOADO CANAFISTULA DE BAIXO, S/N, PREDIO, ZONA RURAL, 57360000",35201459
Alagoas,AL,27,Girau do Ponciano,2702900,Agreste Alagoano,2,ESCOLA MUNICIPAL DE EDUCACAO BASICA RUI BARBOSA,27019462,3,2,1,,1,1,"POVOADO GRUTA DAS CANAS, SN, PREDIO, ZONA RURAL, 57360000",35201459
Alagoas,AL,27,Girau do Ponciano,2702900,Agreste Alagoano,2,ESCOLA MUNICIPAL DE EDUCACAO BASICA PROFESSOR ANTONIO VITOR BARBOSA,27019470,3,2,1,,1,1,"POVOADO QUEBRADENTE, S/N, PREDIO, ZONA RURAL, 57360000",35201459
Alagoas,AL,27,Girau do Ponciano,2702900,Agreste Alagoano,2,ESCOLA MUNICIPAL DE EDUCACAO BASICA JOSE ALENCAR GOMES DA SILVA,27048349,3,2,1,,1,1,"ASSENTAMENTO ARIZONA II, S/Nº, , ZONA RURAL, 57360000",35201842
Alagoas,AL,27,Girau do Ponciano,2702900,Agreste Alagoano,2,ESCOLA MUNICIPAL DE EDUCACAO BASICA NOSSA SENHORA APARECIDA,27048357,3,2,2,,,,"ASSENTAMENTO BOIADEIRO, S/N, , ZONA RURAL, 57360000",35201842
Alagoas,AL,27,Girau do Ponciano,2702900,Agreste Alagoano,2,CENTRO MUNICIPAL DE EDUCACAO INFANTIL EM TEMPO INTEGRAL PROFESSORA LUCIENE JERONIMO DA ROCHA,27051994,3,1,1,,1,1,"AVENIDA FREI DAMIAO, 513, , SAO TARCISIO, 57360000",996256017
Alagoas,AL,27,Girau do Ponciano,2702900,Agreste Alagoano,2,CRECHE PROFESSOR JOSE APARECIDO DOS SANTOS,27055825,3,1,1,,1,1,"RUA CATARINA NETO, S/N, , NOSSA SENHORA DA CONCEICAO, 57360000",999615255
Alagoas,AL,27,Girau do Ponciano,2702900,Agreste Alagoano,2,COMPLEXO MUNICIPAL DE EDUCACAO BASICA EM TEMPO INTEGRAL VEREADOR JOSE LIMA MAURICIO,27056210,3,2,2,,,,"LOCALIDADE, S/N, , ZONA RURAL, 57360000",999521933
Alagoas,AL,27,Girau do Ponciano,2702900,Agreste Alagoano,2,ESCOLA MUNICIPAL DE EDUCACAO BASICA MIGUEL ELIAS BEZERRA,27216560,3,2,1,,1,1,"POVOADO PAU DAGUA, SN, , ZONA RURAL, 57360000",35201459
Alagoas,AL,27,Girau do Ponciano,2702900,Agreste Alagoano,2,ESCOLA MUNICIPAL DE EDUCACAO BASICA MANOEL CORREIA DE BARROS,27216730,3,2,1,,1,1,"POVOADO CHA DOS BARROS, SN, , ZONA RURAL, 57360000",
Alagoas,AL,27,Girau do Ponciano,2702900,Agreste Alagoano,2,ESCOLA MUNICIPAL DE EDUCACAO BASICA GRACILIANO RAMOS,27216799,3,2,1,,1,1,"POVOADO BOA VISTA, SN, , ZONA RURAL, 57360000",99413634
Alagoas,AL,27,Girau do Ponciano,2702900,Agreste Alagoano,2,ESCOLA MUNICIPAL DE EDUCACAO BASICA SANTA EFIGENIA,27216888,3,2,1,,1,1,"FAZENDA SANTA EFIGENIA, S/N, , ZONA RURAL, 57360000",35201842
Alagoas,AL,27,Girau do Ponciano,2702900,Agreste Alagoano,2,ESCOLA MUNICIPAL DE EDUCACAO BASICA SAO SEBASTIAO,27218260,3,2,1,,1,1,"POVOADO JAPAO II, SN, PREDIO, ZONA RURAL, 57360000",35201459
Alagoas,AL,27,Girau do Ponciano,2702900,Agreste Alagoano,2,ESCOLA ESTADUAL DEPUTADO GILVAN BARROS,27220087,2,1,1,,1,1,"AL 115 KM02 RODOVIA DIVALDO SURUAGY, , , PROGRESSO, 57360000",
Alagoas,AL,27,Girau do Ponciano,2702900,Agreste Alagoano,2,ESCOLA MUNICIPAL DE EDUCACAO BASICA SANTA IZABEL,27221520,3,2,1,,1,1,"ASSENTAMENTO SANTA ISABEL, SN, , ZONA RURAL, 57360000",996618214
Alagoas,AL,27,Girau do Ponciano,2702900,Agreste Alagoano,2,ESCOLA MUNICIPAL DE EDUCACAO BASICA DOUTOR RICARDO VITORIO,27221547,3,2,1,,1,1,"ASSENTAMENTO PARANA, , , ZONA RURAL, 57360000",35201876
Alagoas,AL,27,Girau do Ponciano,2702900,Agreste Alagoano,2,ESCOLA MUNICIPAL DE EDUCACAO BASICA JUVIANA MARIA PINHEIRO,27221555,3,2,1,,1,1,"POVOADO SERRINHA II, SN, PREDIO, ZONA RURAL, 57360000",35201459
Alagoas,AL,27,Girau do Ponciano,2702900,Agreste Alagoano,2,ESCOLA MUNICIPAL DE EDUCACAO BASICA LUCIANO ALVES DA SILVA,27223000,3,2,1,,1,1,"ASSENTAMENTO 25 DE JULHO, S/Nº, PADRE CICERO, ZONA RURAL, 57360000",35201842
Alagoas,AL,27,Girau do Ponciano,2702900,Agreste Alagoano,2,ESCOLA MUNICIPAL DE EDUCACAO BASICA JOSE DE MESSIAS BARROS,27223868,3,1,1,,1,1,"AVENIDA JOSE DE MESSIAS BARROS, SN, PREDIO, TORROES, 57360000",35201842
Alagoas,AL,27,Girau do Ponciano,2702900,Agreste Alagoano,2,CENTRO MUNICIPAL DE EDUCACAO INFANTIL SENADOR DARCY RIBEIRO,27223981,3,2,2,,,,"ASSENTAMENTO MARAVILHA, , , ZONA RURAL, 57360000",35201842
Alagoas,AL,27,Girau do Ponciano,2702900,Agreste Alagoano,2,CENTRO MUNICIPAL DE EDUCACAO INFANTIL PROFESSOR JOSE ENOQUE DE BARROS,27224007,3,1,1,,1,1,"AVENIDA TIRADENTES, S/N, , PROGRESSO, 57360000",35201459
Alagoas,AL,27,Girau do Ponciano,2702900,Agreste Alagoano,2,ESCOLA MUNICIPAL DE EDUCACAO BASICA PROFESSOR PAULO FREIRE,27225470,3,2,1,,1,1,"ASSENTAMENTO CARRO QUEIMADO, S/N, PREDIO, ZONA RURAL, 57360000",35201842
Alagoas,AL,27,Girau do Ponciano,2702900,Agreste Alagoano,2,ESCOLA MUNICIPAL DE EDUCACAO BASICA MONTEIRO LOBATO,27225488,3,2,2,,,,"POVOADO MASSARANDUBA, SN, , , 57360000",35201459
Alagoas,AL,27,Girau do Ponciano,2702900,Agreste Alagoano,2,ESCOLA MUNICIPAL DE EDUCACAO BASICA DOM HELDER CAMARA,27225500,3,2,1,,1,1,"ASSENTAMENTO SETE CASAS, SN, PREDIO, ZONA RURAL, 57360000",35201459
Alagoas,AL,27,Girau do Ponciano,2702900,Agreste Alagoano,2,ESCOLA MUNICIPAL DE EDUCACAO BASICA VEREADOR ANTONIO ALVES,27259005,3,1,1,,1,1,"AVENIDA JOSE PEREIRA BEZERRA, S/N, S/N, , NOSSA SENHORA DA CONCEICAO, 57360000",35201842
Alagoas,AL,27,Girau do Ponciano,2702900,Agreste Alagoano,2,ESCOLA MUNICIPAL DE EDUCACAO BASICA SANTA MONICA,27323013,3,2,1,,1,1,"POVOADO LAGOA DA TROVOADA, SN, PREDIO, ZONA RURAL, 57360000",35201459
Alagoas,AL,27,Girau do Ponciano,2702900,Agreste Alagoano,2,ESCOLA MUNICIPAL DE EDUCACAO BASICA ZUMBI DOS PALMARES,27323021,3,2,2,,,,"ASSENTAMENTO DOM HELDER CAMARA, NUCLEO 1º DE MAIO, S/N, CASA, ZONA RURAL, 57360000",35201842
Alagoas,AL,27,Ibateguara,2703007,Leste Alagoano,3,ESCOLA MUL ENS FUND MAJ CICERO DE GOES MONTEIRO,27022579,3,2,1,,1,1,"POVOADO ROCADINHO, S/N, PREDIO, ZONA RURAL, 57890000",32037282
Alagoas,AL,27,Ibateguara,2703007,Leste Alagoano,3,ESCOLA MUL DE ENS FUND BEJAMIM BUARQUE DE GUSMAO,27022587,3,2,1,,1,1,"LARANJEIRA DOS BUARQUES, , PREDIO, ZONA RURAL, 57890000",987170110
Alagoas,AL,27,Ibateguara,2703007,Leste Alagoano,3,ESCOLA MUL DE ENS FUND CORONEL JOAQUIM LUIZ,27022595,3,2,1,,1,2,"SITIO HORIZONTE, , CASA, ZONA RURAL, 57890000",32031412
Alagoas,AL,27,Ibateguara,2703007,Leste Alagoano,3,ESCOLA MUNICIPAL DE ENSINO FUND FLORIANO PEIXOTO,27022617,3,2,1,,1,1,"SITIO LARANJEIRAS, , PREDIO, ZONA RURAL, 57890000",32031412
Alagoas,AL,27,Ibateguara,2703007,Leste Alagoano,3,ESCOLA ESTADUAL GREGORIO CALDAS,27022625,2,2,2,,,,"RUA DA ESPERANCA, SN, , DISTRITO CANASTRA, 57890000",32036168
Alagoas,AL,27,Ibateguara,2703007,Leste Alagoano,3,ESCOLA MUNICIPAL DE ENS FUND JOSE MARQUES DE LIMA,27022650,3,2,1,,1,2,"SIITIO BANANEIRA DO LELE, S/N, CASA, ZONA RURAL, 57890000",32031412
Alagoas,AL,27,Ibateguara,2703007,Leste Alagoano,3,ESCOLA MUL DE ENS FUND MAMEDES SOARES BOTELHO,27022676,3,2,1,,1,2,"SITIO HORIZONTE, , CASA, ZONA RURAL, 57890000",32031412
Alagoas,AL,27,Ibateguara,2703007,Leste Alagoano,3,ESCOLA MUNICIPAL DE ENSINO FUND GONCALVES DIAS,27022714,3,2,2,,,,"SITIO SANTA MARIA DAS PEDRAS, , , , 57890000",32031412
Alagoas,AL,27,Ibateguara,2703007,Leste Alagoano,3,ESCOLA MUNICIPAL DE ENSINO FUNDAMENTAL JOANA D ARC,27022722,3,2,1,,1,1,"SITIO TRIUNFO, , CASA, ZONA RURA, 57890000",987170110
Alagoas,AL,27,Ibateguara,2703007,Leste Alagoano,3,ESCOLA MUNICIPAL DE ENS FUND NOSSA SRª DO CARMO,27022757,3,2,1,,1,1,"POVOADO BASTIOES, , CASA, ZONA RURAL, 57890000",32031857
Alagoas,AL,27,Ibateguara,2703007,Leste Alagoano,3,ESCOLA MUNICIPAL DE ENSINO FUND PRINCESA IZABEL,27022765,3,2,1,,1,2,"ASSENTAMENTO AGROVILA, , SITIO, ZONA RURAL, 57890000",32031857
Alagoas,AL,27,Ibateguara,2703007,Leste Alagoano,3,ESCOLA MUNICIPAL DE ENSINO FUND SEBASTIAO HENRIQUE,27022781,3,2,1,,1,1,"SITIO JUSSARA, , CASA, ZONA RURAL, 57890000",32031857
Alagoas,AL,27,Ibateguara,2703007,Leste Alagoano,3,ESCOLA MUNICIPAL DE ENSINO FUND PADRE CICERO,27022790,3,2,1,,1,2,"SITIO HORIZONTE, , CASA, ZONA RURAL, 57890000",32031412
Alagoas,AL,27,Ibateguara,2703007,Leste Alagoano,3,ESCOLA MUNICIPAL DE ENS FUND PEDRO ALVARES CABRAL,27022803,3,2,2,,,,"SITIO, , , , 57890000",32031857
